{
  "schema": "https://aliakbari.dev/schemas/ops-rollup-v1.json",
  "report_version": 1,
  "sli_version": 1,
  "date": "2026-10-12",
  "window": {
    "start": "2026-10-12T00:00:00Z",
    "end": "2026-10-13T00:00:00Z"
  },
  "service": "https://aliakbari.dev",
  "generator": {
    "name": "opsledger",
    "version": "ops-publish",
    "commit": "24aa94eb02613bae218d0fe86eedd69e26dd9953"
  },
  "origin": {
    "observer": {
      "id": "origin-nginx",
      "kind": "self-reported",
      "description": "nginx on the production host, as recorded by opsledger on the same host. These numbers are reported by the system they describe."
    },
    "method": "Every request nginx handles is written as a JSON access-log record to a Unix datagram socket (nginx's syslog transport). opsledger parses each record, classifies it and aggregates it per minute (counts by outcome and status class, an exact latency-threshold count, and a base-2 exponential histogram of $request_time). Once a minute, opsledger also reads nginx's own request counter (stub_status) so that records lost in transit can be counted.",
    "recorder": {
      "name": "opsledger",
      "version": "dev",
      "commit": "9a6445541ac350bbaefdb44f9c4e0482ce162d9d"
    },
    "hours": [
      {
        "hour": 0,
        "cells": [],
        "ingest": {
          "received": 0,
          "accepted": 0,
          "malformed": 0,
          "dropped": 0,
          "rejected": 0
        },
        "reconciliation": {
          "nginx_requests": 0,
          "received": 0,
          "reconciled_seconds": 0,
          "unreconciled_seconds": 0
        }
      },
      {
        "hour": 1,
        "cells": [],
        "ingest": {
          "received": 0,
          "accepted": 0,
          "malformed": 0,
          "dropped": 0,
          "rejected": 0
        },
        "reconciliation": {
          "nginx_requests": 0,
          "received": 0,
          "reconciled_seconds": 0,
          "unreconciled_seconds": 0
        }
      },
      {
        "hour": 2,
        "cells": [],
        "ingest": {
          "received": 0,
          "accepted": 0,
          "malformed": 0,
          "dropped": 0,
          "rejected": 0
        },
        "reconciliation": {
          "nginx_requests": 0,
          "received": 0,
          "reconciled_seconds": 0,
          "unreconciled_seconds": 0
        }
      },
      {
        "hour": 3,
        "cells": [],
        "ingest": {
          "received": 0,
          "accepted": 0,
          "malformed": 0,
          "dropped": 0,
          "rejected": 0
        },
        "reconciliation": {
          "nginx_requests": 0,
          "received": 0,
          "reconciled_seconds": 0,
          "unreconciled_seconds": 0
        }
      },
      {
        "hour": 4,
        "cells": [],
        "ingest": {
          "received": 0,
          "accepted": 0,
          "malformed": 0,
          "dropped": 0,
          "rejected": 0
        },
        "reconciliation": {
          "nginx_requests": 0,
          "received": 0,
          "reconciled_seconds": 0,
          "unreconciled_seconds": 0
        }
      },
      {
        "hour": 5,
        "cells": [],
        "ingest": {
          "received": 0,
          "accepted": 0,
          "malformed": 0,
          "dropped": 0,
          "rejected": 0
        },
        "reconciliation": {
          "nginx_requests": 0,
          "received": 0,
          "reconciled_seconds": 0,
          "unreconciled_seconds": 0
        }
      },
      {
        "hour": 6,
        "cells": [],
        "ingest": {
          "received": 0,
          "accepted": 0,
          "malformed": 0,
          "dropped": 0,
          "rejected": 0
        },
        "reconciliation": {
          "nginx_requests": 0,
          "received": 0,
          "reconciled_seconds": 0,
          "unreconciled_seconds": 0
        }
      },
      {
        "hour": 7,
        "cells": [],
        "ingest": {
          "received": 0,
          "accepted": 0,
          "malformed": 0,
          "dropped": 0,
          "rejected": 0
        },
        "reconciliation": {
          "nginx_requests": 0,
          "received": 0,
          "reconciled_seconds": 0,
          "unreconciled_seconds": 0
        }
      },
      {
        "hour": 8,
        "cells": [],
        "ingest": {
          "received": 0,
          "accepted": 0,
          "malformed": 0,
          "dropped": 0,
          "rejected": 0
        },
        "reconciliation": {
          "nginx_requests": 0,
          "received": 0,
          "reconciled_seconds": 0,
          "unreconciled_seconds": 0
        }
      },
      {
        "hour": 9,
        "cells": [],
        "ingest": {
          "received": 0,
          "accepted": 0,
          "malformed": 0,
          "dropped": 0,
          "rejected": 0
        },
        "reconciliation": {
          "nginx_requests": 0,
          "received": 0,
          "reconciled_seconds": 0,
          "unreconciled_seconds": 0
        }
      },
      {
        "hour": 10,
        "cells": [],
        "ingest": {
          "received": 0,
          "accepted": 0,
          "malformed": 0,
          "dropped": 0,
          "rejected": 0
        },
        "reconciliation": {
          "nginx_requests": 0,
          "received": 0,
          "reconciled_seconds": 0,
          "unreconciled_seconds": 0
        }
      },
      {
        "hour": 11,
        "cells": [],
        "ingest": {
          "received": 0,
          "accepted": 0,
          "malformed": 0,
          "dropped": 0,
          "rejected": 0
        },
        "reconciliation": {
          "nginx_requests": 0,
          "received": 0,
          "reconciled_seconds": 0,
          "unreconciled_seconds": 0
        }
      },
      {
        "hour": 12,
        "cells": [],
        "ingest": {
          "received": 0,
          "accepted": 0,
          "malformed": 0,
          "dropped": 0,
          "rejected": 0
        },
        "reconciliation": {
          "nginx_requests": 0,
          "received": 0,
          "reconciled_seconds": 0,
          "unreconciled_seconds": 0
        }
      },
      {
        "hour": 13,
        "cells": [],
        "ingest": {
          "received": 0,
          "accepted": 0,
          "malformed": 0,
          "dropped": 0,
          "rejected": 0
        },
        "reconciliation": {
          "nginx_requests": 0,
          "received": 0,
          "reconciled_seconds": 0,
          "unreconciled_seconds": 0
        }
      },
      {
        "hour": 14,
        "cells": [],
        "ingest": {
          "received": 0,
          "accepted": 0,
          "malformed": 0,
          "dropped": 0,
          "rejected": 0
        },
        "reconciliation": {
          "nginx_requests": 0,
          "received": 0,
          "reconciled_seconds": 0,
          "unreconciled_seconds": 0
        }
      },
      {
        "hour": 15,
        "cells": [],
        "ingest": {
          "received": 0,
          "accepted": 0,
          "malformed": 0,
          "dropped": 0,
          "rejected": 0
        },
        "reconciliation": {
          "nginx_requests": 0,
          "received": 0,
          "reconciled_seconds": 0,
          "unreconciled_seconds": 0
        }
      },
      {
        "hour": 16,
        "cells": [],
        "ingest": {
          "received": 0,
          "accepted": 0,
          "malformed": 0,
          "dropped": 0,
          "rejected": 0
        },
        "reconciliation": {
          "nginx_requests": 0,
          "received": 0,
          "reconciled_seconds": 0,
          "unreconciled_seconds": 0
        }
      },
      {
        "hour": 17,
        "cells": [],
        "ingest": {
          "received": 0,
          "accepted": 0,
          "malformed": 0,
          "dropped": 0,
          "rejected": 0
        },
        "reconciliation": {
          "nginx_requests": 0,
          "received": 0,
          "reconciled_seconds": 0,
          "unreconciled_seconds": 0
        }
      },
      {
        "hour": 18,
        "cells": [
          {
            "class": "analytics",
            "observer": "organic",
            "agent": "human",
            "total": 547,
            "ok": 547,
            "blocked": 0,
            "rate_limited": 0,
            "client_closed": 0,
            "server_error": 0,
            "s1xx": 0,
            "s2xx": 547,
            "s3xx": 0,
            "s4xx": 0,
            "s5xx": 0,
            "lat_eligible": 0,
            "lat_good": 0,
            "latency": {
              "scale": 3,
              "zero_count": 0,
              "offset": 79,
              "counts": [
                35,
                0,
                0,
                0,
                0,
                0,
                0,
                0,
                205,
                0,
                0,
                0,
                0,
                147,
                0,
                0,
                58,
                0,
                0,
                34,
                0,
                22,
                0,
                15,
                2,
                0,
                4,
                3,
                3,
                0,
                4,
                6,
                1,
                0,
                0,
                3,
                1,
                0,
                1,
                0,
                0,
                0,
                0,
                0,
                0,
                1,
                2
              ],
              "sum": 2060000,
              "min": 1000,
              "max": 55000
            }
          },
          {
            "class": "api",
            "observer": "organic",
            "agent": "bot",
            "total": 5,
            "ok": 5,
            "blocked": 0,
            "rate_limited": 0,
            "client_closed": 0,
            "server_error": 0,